,Month,Date Event Began,Time Event Began,Date of Restoration,Time of Restoration,Area Affected,NERC Region,Alert Criteria,Event Type,Demand Loss (MW),Number of Customers Affected
0,January,01/30/2019,04:23:00,02/02/2019,09:00:00,Illinois: Scott County;,SERC,Fuel supply emergencies that could impact electric power system adequacy or reliability.,Fuel Supply Deficiency,Unknown,Unknown
1,January,01/30/2019,07:00:00,01/30/2019,08:08:00,Illinois: Pike County;,SERC,Fuel supply emergencies that could impact electric power system adequacy or reliability.,Severe Weather,Unknown,Unknown
2,February,02/20/2019,12:50:00,02/20/2019,13:32:00,"Wisconsin, Minnesota, Iowa, Illinois",MRO,Complete loss of monitoring or control capability at its staffed Bulk Electric System control center for 30 continuous minutes or more.,System Operations,740,0
3,June,06/30/2019,15:30:00,06/30/2019,20:30:00,"Illinois: Cook County, DeKalb County, DuPage County, Grundy County, Iroquois County, Ford County, Lake County, Kendall County, Kankakee County, Kane County, Ogle County;",SERC,"Loss of electric service to more than 50,000 customers for 1 hour or more.",Severe Weather,Unknown,100000
4,December,12/24/2019,15:30:00,12/24/2019,19:34:00,Illinois:,SERC,"Physical threat to its Facility excluding weather or natural disaster related threats, which has the potential to degrade the normal operation of the Facility. Or suspicious device or activity at its Facility.",Suspicious Activity,0,0
