,Month,Date Event Began,Time Event Began,Date of Restoration,Time of Restoration,Area Affected,NERC Region,Alert Criteria,Event Type,Demand Loss (MW),Number of Customers Affected
0,February,02/11/2021,08:30:00,02/22/2021,09:00:00,Illinois: Scott County;,SERC,Fuel supply emergencies that could impact electric power system adequacy or reliability.,Fuel Supply Deficiency,Unknown,Unknown
1,February,02/16/2021,05:30:00,02/16/2021,14:00:00,Louisiana: Texas: Illinois:,SERC,Firm load shedding of 100 Megawatts or more implemented under emergency operational policy.,Severe Weather,1420,Unknown
2,February,02/16/2021,07:00:00,Unknown,Unknown,New Jersey: Pennsylvania: Texas: California: Illinois: Colorado:,RF,Cyber event that could potentially impact electric power system adequacy or reliability.,Cyber Event,Unknown,0
3,July,07/18/2021,04:00:00,07/18/2021,09:46:00,Illinois: Cook County;,RF,"Unexpected Transmission loss within its area, contrary to design, of three or more Bulk Electric System Facilities caused by a common disturbance (excluding successful automatic reclosing).",Transmission Interruption,0,0
4,August,08/10/2021,20:30:00,08/11/2021,19:00:00,Illinois:,RF/SERC,"Loss of electric service to more than 50,000 customers for 1 hour or more",Severe Weather,Unknown,318761
5,August,08/12/2021,18:57:00,08/13/2021,06:00:00,Illinois: Missouri:,RF/SERC,"Loss of electric service to more than 50,000 customers for 1 hour or more",Severe Weather,Unknown,101000
6,October,10/12/2021,20:08:00,10/12/2021,20:09:00,Illinois: Cook County;,RF,"Physical threat to its Facility excluding weather or natural disaster related threats, which has the potential to degrade the normal operation of the Facility. Or suspicious device or activity at its Facility.",Suspicious Activity,0,0
